{
  "version": "0.1.0",
  "type": "runtimeDesignTheme",
  "id": "ledgerpilot-runtime-theme",
  "name": "LedgerPilot Runtime Theme",
  "source": {
    "primarySeedRef": "shared/examples/marketing-page-e2e/marketing-page.design-system-seed.example.json",
    "sourceRefs": [
      {
        "type": "designSystemSeed",
        "ref": "shared/examples/marketing-page-e2e/marketing-page.design-system-seed.example.json",
        "id": "ledgerpilot-design-system-seed",
        "schemaRef": "shared/schemas/design-system-seed.schema.json",
        "confidence": "medium",
        "notes": [
          "Runtime theme expands the seed into viewer-facing token groups."
        ]
      },
      {
        "type": "userProvidedBrandAsset",
        "ref": "assets/ledgerpilot/logo.svg",
        "confidence": "high",
        "notes": [
          "Package-safe placeholder path for a user-provided logo asset."
        ]
      }
    ],
    "confidence": "medium",
    "notes": [
      "Contrast ratios marked requiresCheck are not production-certified."
    ]
  },
  "brandAssets": {
    "assets": [
      {
        "id": "ledgerpilot-logo",
        "type": "logo",
        "sourceType": "userProvidedAsset",
        "ref": "assets/ledgerpilot/logo.svg",
        "format": "svg",
        "safeBackgrounds": [
          "color.surface.default",
          "color.surface.inverse"
        ],
        "doNotUseOn": [
          "color.brand.primary",
          "color.status.info.background"
        ],
        "extractedColors": [
          {
            "name": "LedgerPilot logo blue",
            "value": "#145C9E",
            "role": "logoPrimary",
            "usage": "Logo mark and brand-primary semantic mapping candidate.",
            "provenance": {
              "source": "userProvided",
              "confidence": "high",
              "sourceRef": "assets/ledgerpilot/logo.svg"
            }
          }
        ],
        "provenance": {
          "source": "userProvided",
          "confidence": "high",
          "sourceRef": "assets/ledgerpilot/logo.svg"
        },
        "notes": [
          "Asset colors still map through semantic tokens before component use."
        ]
      }
    ],
    "usageNotes": [
      "Render the logo only on declared safe backgrounds.",
      "Do not use logo colors directly in components without semantic mapping."
    ]
  },
  "colorSystem": {
    "primitives": {
      "color.brand.primaryBase": {
        "value": "#145C9E",
        "family": "brand",
        "step": "primaryBase",
        "provenance": {
          "source": "userProvided",
          "confidence": "high",
          "sourceRef": "assets/ledgerpilot/logo.svg"
        }
      },
      "color.brand.primaryDark": {
        "value": "#0C3E70",
        "family": "brand",
        "step": "primaryDark",
        "provenance": {
          "source": "generated",
          "confidence": "medium",
          "note": "Generated support shade for active states."
        }
      },
      "color.neutral.white": {
        "value": "#FFFFFF",
        "family": "neutral",
        "step": "white",
        "provenance": {
          "source": "recommended",
          "confidence": "medium"
        }
      },
      "color.neutral.ink": {
        "value": "#16202A",
        "family": "neutral",
        "step": "ink",
        "provenance": {
          "source": "recommended",
          "confidence": "medium"
        }
      },
      "color.neutral.muted": {
        "value": "#6B7684",
        "family": "neutral",
        "step": "muted",
        "provenance": {
          "source": "generated",
          "confidence": "medium"
        }
      },
      "color.neutral.subtle": {
        "value": "#F4F7FA",
        "family": "neutral",
        "step": "subtle",
        "provenance": {
          "source": "generated",
          "confidence": "medium"
        }
      },
      "color.status.successBase": {
        "value": "#16833A",
        "family": "success",
        "step": "base",
        "provenance": {
          "source": "generated",
          "confidence": "medium"
        }
      },
      "color.status.errorBase": {
        "value": "#C62828",
        "family": "error",
        "step": "base",
        "provenance": {
          "source": "generated",
          "confidence": "medium"
        }
      },
      "color.status.warningBase": {
        "value": "#A45B00",
        "family": "warning",
        "step": "base",
        "provenance": {
          "source": "generated",
          "confidence": "medium"
        }
      },
      "color.status.infoBase": {
        "value": "#2563A8",
        "family": "info",
        "step": "base",
        "provenance": {
          "source": "generated",
          "confidence": "medium"
        }
      },
      "color.focus.ring": {
        "value": "#3B82F6",
        "family": "focus",
        "step": "ring",
        "provenance": {
          "source": "recommended",
          "confidence": "medium"
        }
      }
    },
    "ramps": {
      "brand": {
        "family": "brand",
        "steps": {
          "base": "color.brand.primaryBase",
          "dark": "color.brand.primaryDark"
        },
        "usage": "Primary brand and action family.",
        "provenance": {
          "source": "userProvided",
          "confidence": "high",
          "sourceRef": "assets/ledgerpilot/logo.svg"
        }
      },
      "status": {
        "family": "status",
        "steps": {
          "success": "color.status.successBase",
          "error": "color.status.errorBase",
          "warning": "color.status.warningBase",
          "info": "color.status.infoBase"
        },
        "usage": "Feedback and validation states.",
        "provenance": {
          "source": "generated",
          "confidence": "medium"
        }
      }
    },
    "semantic": {
      "color.brand.primary": {
        "primitive": "color.brand.primaryBase",
        "intent": "Primary brand color from logo asset.",
        "usage": "Brand marks and high-emphasis accents after contrast review.",
        "provenance": {
          "source": "userProvided",
          "confidence": "high",
          "sourceRef": "assets/ledgerpilot/logo.svg"
        }
      },
      "color.action.primary": {
        "primitive": "color.brand.primaryBase",
        "intent": "Primary conversion action.",
        "usage": "Main CTA and selected high-emphasis controls.",
        "provenance": {
          "source": "recommended",
          "confidence": "medium"
        }
      },
      "color.action.primaryHover": {
        "primitive": "color.brand.primaryDark",
        "intent": "Hover or active primary action state.",
        "usage": "Primary button hover and active states.",
        "provenance": {
          "source": "generated",
          "confidence": "medium"
        }
      },
      "color.surface.default": {
        "primitive": "color.neutral.white",
        "intent": "Default readable surface.",
        "usage": "Page and card backgrounds.",
        "provenance": {
          "source": "recommended",
          "confidence": "medium"
        }
      },
      "color.surface.subtle": {
        "primitive": "color.neutral.subtle",
        "intent": "Subtle grouped content surface.",
        "usage": "Low-emphasis section backgrounds.",
        "provenance": {
          "source": "generated",
          "confidence": "medium"
        }
      },
      "color.surface.inverse": {
        "primitive": "color.neutral.ink",
        "intent": "Dark inverse surface.",
        "usage": "Small high-contrast preview blocks and footer.",
        "provenance": {
          "source": "recommended",
          "confidence": "medium"
        }
      },
      "color.text.primary": {
        "primitive": "color.neutral.ink",
        "intent": "Primary readable text.",
        "usage": "Headings and body copy.",
        "provenance": {
          "source": "recommended",
          "confidence": "medium"
        }
      },
      "color.text.inverse": {
        "primitive": "color.neutral.white",
        "intent": "Text on dark or brand surfaces.",
        "usage": "Button labels and inverse surfaces.",
        "provenance": {
          "source": "recommended",
          "confidence": "medium"
        }
      },
      "color.text.muted": {
        "primitive": "color.neutral.muted",
        "intent": "Lower emphasis readable text.",
        "usage": "Supporting copy and metadata.",
        "provenance": {
          "source": "generated",
          "confidence": "medium"
        }
      },
      "color.status.success.background": {
        "primitive": "color.status.successBase",
        "intent": "Success state background.",
        "usage": "Success alert, toast, and validation state.",
        "provenance": {
          "source": "generated",
          "confidence": "medium"
        }
      },
      "color.status.error.background": {
        "primitive": "color.status.errorBase",
        "intent": "Error state background.",
        "usage": "Error alert, toast, and validation state.",
        "provenance": {
          "source": "generated",
          "confidence": "medium"
        }
      },
      "color.status.warning.background": {
        "primitive": "color.status.warningBase",
        "intent": "Warning state background.",
        "usage": "Warning alert and cautionary state.",
        "provenance": {
          "source": "generated",
          "confidence": "medium"
        }
      },
      "color.status.info.background": {
        "primitive": "color.status.infoBase",
        "intent": "Information state background.",
        "usage": "Informational alert and status message.",
        "provenance": {
          "source": "generated",
          "confidence": "medium"
        }
      },
      "color.focus.ring": {
        "primitive": "color.focus.ring",
        "intent": "Visible keyboard focus ring.",
        "usage": "Focus outline for interactive controls.",
        "provenance": {